,url-info,memento-datetime,tweet-url,memento-url,tweet-content
76,"com,twitter)/an_cabraal/status/1324288632098758657",20201105095318,https://twitter.com/an_cabraal/status/1324288632098758657,https://web.archive.org/web/20201105095318/https://twitter.com/an_cabraal/status/1324288632098758657,Trade deficit contracts by over USD 1billion during the 8 months ending August 2020 compared to the corresponding period of 2019: #Rupee steady: interest rates continue at low levels for the 10th consecutive month @CSE_Media #EconomicRecoveryPlan #CentralBankSL #lka
77,"com,twitter)/an_cabraal/status/1324288815624646656",20201105095404,https://twitter.com/an_cabraal/status/1324288815624646656,https://web.archive.org/web/20201105095404/https://twitter.com/an_cabraal/status/1324288815624646656,Trade deficit contracts by over USD 1 billion during the 8 months ending August 2020 compared to the corresponding period of 2019: #Rupee steady: interest rates continue at low levels for the 10th consecutive month @CSE_Media #EconomicRecoveryPlan #CentralBankSL #lka
84,"com,twitter)/an_cabraal/status/1324956732964081665",20210501223115,https://twitter.com/an_cabraal/status/1324956732964081665,https://web.archive.org/web/20210501223115/https://twitter.com/an_cabraal/status/1324956732964081665,"Contrary to adverse expectations, Central Govt Debt will be well below 100% of #GDP in 2020: with our integrated #Debt Management plan, we hope to reduce it to 70% by 2025 @CBSL @IMFNews @FitchRatings @MoodysInvSvc #lka #EconomicRecoveryPlan Here we go again!!! Why don't we start with reporting the GDP data for Q2??? Yes pls , the government must reveal Sri Lanka will never fall, until we have wonderful leaders like You, Proud to be Sri Lankan, we also do our bit to make Sri Lanka wonder of Asia,,,, we ll participate in the economy at our fullest while obeying health guidelines ,,,  නන්දසේන #සfail Dear Sri Lankans.....
Obey Health guidelines
Work Hard
Work Efficiently
Work Effectively
Be Creative  
Reuse (specially things that we Import)
Buy Made in Sri Lanka
& Invest
If every one of us can practice these we are better than Singapore by 2025,,  GDP is the number given to the value of manufacture. 

Ahem...

 In this age of media reality the good minister might be banking on an entirely new source of value.

 The value of manufacturing the GDP number.  Unless, CBSL is wrong our liquid reserves are USD 5.1 billion. Another  1.1 billion needs to be paid within 30 days.  Within 12 months it is USD 4.5 billion. This all in US dollars. You cannot inflate that or print that.  That is not going to go away. That is the reality. Yes, you can do it.. You can see a sunshine even inside a deep mine..  @GotabayaR @PresRajapaksa @SecPompeo 
Please work on to allow @PayPal business accounts (Merchant) in Sri Lanka. There are lot of people in here willing to enter the international market, however it is impossible due to above issue. Among them most are the younger generation. Ecommerce sector is growing in SL gradually and ready to run with the global markets. Lot of traditional product manufacturers are now arising with the current government policies."
125,"com,twitter)/an_cabraal/status/1332568827725418498",20201128061618,https://twitter.com/an_cabraal/status/1332568827725418498,https://web.archive.org/web/20201128061618/https://twitter.com/an_cabraal/status/1332568827725418498,"The Y'palana Govt borrowed a massive USD 6.9 billion (9.8% of GDP) in #ISBs in a 15-mth period Apr18-Jun19, the cost of 6 #Hambanthota Ports!
Now, the int'l agencies that promoted those loans say #SL has a debt problem! We reduced SL's #debt /GDP ratio from 91% to 70% from 2006-14, and we'll do that again by 2025 @CBSL @FitchRatings #lka #economicrecoveryplan #economicrecoveryplan"
126,"com,twitter)/an_cabraal/status/1332568829948428290",20201128061610,https://twitter.com/an_cabraal/status/1332568829948428290,https://web.archive.org/web/20201128061610/https://twitter.com/an_cabraal/status/1332568829948428290,"The Y'palana Govt borrowed a massive USD 6.9 billion (9.8% of GDP) in #ISBs in a 15-mth period Apr18-Jun19, the cost of 6 #Hambanthota Ports!
Now, the int'l agencies that promoted those loans say #SL has a debt problem! We reduced SL's #debt /GDP ratio from 91% to 70% from 2006-14, and we'll do that again by 2025 @CBSL @FitchRatings #lka #economicrecoveryplan #economicrecoveryplan"
152,"com,twitter)/an_cabraal/status/1342299812528472064",20201225024319,https://twitter.com/an_cabraal/status/1342299812528472064,https://web.archive.org/web/20201225024319/https://twitter.com/an_cabraal/status/1342299812528472064,"Congratulations to 1229 #companies incorporated during Nov 2020. Encouraging to see our efforts to create a conducive environment for #business activities in SL being made use of by our country’s #entrepreneur @CBSL #lka #economyrisingpic.twitter.com/H1jgBQrixF We’ve opened a company while we’re in overseas however sad to say that non of the bank let us open a bank account online. It is how lots of dollars #LK missed in 2020 from our business.I’m disappointed about that fact @IDhamith @shiyam160 @dsrajapaksa 
Thank you all for you comments I will be certainly looking at these suggestions on the way forward!"
153,"com,twitter)/an_cabraal/status/1342320261664702464",20201225040614,https://twitter.com/an_cabraal/status/1342320261664702464,https://web.archive.org/web/20201225040614/https://twitter.com/an_cabraal/status/1342320261664702464,Sri Lanka's #trade gap narrowed by USD 1.6 bn in the first 10 months of 2020. Worker #remittances improved by 4% in the first 11 months. Clear signs of a current account #surplus in Q3. @CBSL @CSE_Media #economicrecoveryplan
183,"com,twitter)/an_cabraal/status/1355419474388799488",20210130073623,https://twitter.com/an_cabraal/status/1355419474388799488,https://web.archive.org/web/20210130073623/https://twitter.com/an_cabraal/status/1355419474388799488,"Sri Lanka exporters should convert, #rupee worth 185 to #dollar: Minister Cabraal. @CBSL @Economynext #lkahttps://economynext.com/sri-lanka-exporters-should-convert-rupee-worth-185-to-dollar-minister-cabraal-78354/ …"
188,"com,twitter)/an_cabraal/status/1360054270377140229",20210212023324,https://twitter.com/an_cabraal/status/1360054270377140229,https://web.archive.org/web/20210212023324/https://twitter.com/an_cabraal/status/1360054270377140229,"At end 2014, @CSE_Media 's market cap was about #USD 24b: today it's only about USD 17b. After 5 years of even modest growth, that means there's a lot of intrinsic value in Sri Lanka's #corporates. #SriLanka #lka #reality #capitalmarket"
196,"com,twitter)/an_cabraal/status/1363055524703465472",20210220091913,https://twitter.com/an_cabraal/status/1363055524703465472,https://web.archive.org/web/20210220091913/https://twitter.com/an_cabraal/status/1363055524703465472,There is absolutely no truth in the mischievous #rumour that #GOSL and @CBSL have directed the conversion of any #NRFC or #RFC account balances into #LKR. There is neither any intention nor a need to do so. @MFA_SriLanka #fakenews #FactCheck #lka #remittance
208,"com,twitter)/an_cabraal/status/1366299761909714955",20210302202307,https://twitter.com/an_cabraal/status/1366299761909714955,https://web.archive.org/web/20210302202307/https://twitter.com/an_cabraal/status/1366299761909714955,"Former @CBSL Deputy Governor & my friend @waw1949  has introduced “Cabraalnomics” to the Econ #lexicon & also said #SL should have a backup rescue plan. As Wije knows, I always have a Plan B & C while implementing Plan A. http://www.ft.lk/columns/Cabraalnomics-No-default-because-we-have-enough-forex-inflows-to-pay-ISBs/4-713907 … @FT_SriLanka #Cabraalnomics #lka Sir, in 2010 22kt was 50k now 100k, property also appreciated some how, most of the sock in cse same level, consider USD then and now, its encouraging FD, need more inflow any plan please We can have some confidence with @an_cabraal but not the Govt. What was the plan on greek bond last time?? And crude oil HEDGING! Why don’t you go for a TV debate with him pic.twitter.com/TBl1HC8Hwy Let's have a debate with @waw1949 
in @hirunews @NewsfirstSL ?

Are you ready? 
Ok ok u know economics Hope it's not borrowing more to settle debt like we always do. Honestly hope you have a sustainable solution by boosting exports/remittances/FDIs n cutting budget deficit below 5% by 2025."
225,"com,twitter)/an_cabraal/status/1368776931999506435",20210308041426,https://twitter.com/an_cabraal/status/1368776931999506435,https://web.archive.org/web/20210308041426/https://twitter.com/an_cabraal/status/1368776931999506435,"CSE's market cap was about USD 20 bln in 2010. After more than 10 years of #profits and #growth, it's still well below USD 16 bln. Indicates substantial space for #investors @CSE_Media #stocks #capitalmarket #SriLankapic.twitter.com/9aYF4WjtXA"
228,"com,twitter)/an_cabraal/status/1369636101422452739",20210310130811,https://twitter.com/an_cabraal/status/1369636101422452739,https://web.archive.org/web/20210310130811/https://twitter.com/an_cabraal/status/1369636101422452739,Happy to confirm that the People's Bank of China has approved a #SWAP facility of 10 billion #Yuan (USD 1.5 billion) to the Central Bank of Sri Lanka. @CBSL @ChinaEmbSL #lka #SriLanka #China #economicrecoveryplan #GOSL
235,"com,twitter)/an_cabraal/status/1370277354656821254",20210524200913,https://twitter.com/an_cabraal/status/1370277354656821254,https://web.archive.org/web/20210524200913/https://twitter.com/an_cabraal/status/1370277354656821254,"An year's #moratorium should have been given to #emerging nations by multi-lateral lending institutions, to deal with the economic fall-out of the Pandemic. #GoSL #COVID19LK #SriLanka #debtpic.twitter.com/NijjGMBOKS If a year’s moratorium is given, you guys will still manage to screw that up as well  Market nisa minissu ada vinasa wela But you and @CBSL confident about loan repayment and boasting about our FC reserves to the media noh.
What has happened now? If could be obtained without altering the prevailing CREDIT RATING, it must be a good solution to SL debt crises. Well said Mr Cabral. Before stock market world number 1 ya then how the hell economics fall out came...  ????  Open mouth with jatyantara kumantrana. Now begging what a shame even beg nobody is giving  where is that tool to balance the USD???  We should have been prepared for all eventualities & have systems in place to create wealth not debt"
248,"com,twitter)/an_cabraal/status/1373324803998814212",20210320172533,https://twitter.com/an_cabraal/status/1373324803998814212,https://web.archive.org/web/20210320172533/https://twitter.com/an_cabraal/status/1373324803998814212,"#SriLanka signed 6 MoU w/ #Bangaladesh today for strengthening youth development, agricultural research, exchange of professional knowledge, training of health nursing staff, international cooperation study & an interchange cultural program for 2021-2025. #NationalMartyrsMemorialpic.twitter.com/AsRdaX185F"
280,"com,twitter)/an_cabraal/status/1375307590314254339",20210328124938,https://twitter.com/an_cabraal/status/1375307590314254339,https://web.archive.org/web/20210328124938/https://twitter.com/an_cabraal/status/1375307590314254339,Had a productive meeting with a cross-section of #Company Secretaries to discuss issues faced by them. Registrar of Companies and his team were very cooperative and we  found solutions to almost all their issues. #SriLanka #GoSL #economicrecoveryplan Why is the registrar of company sending some applications for registration to defence ministry for clearance? Under which section of the Act is he empowered to do that? Any Boi project or investment should be a minimum of 2m dollars to stop us been swamped by gram stores muscat shops and saree shops
281,"com,twitter)/an_cabraal/status/1375307590314254339",20210329013017,https://twitter.com/an_cabraal/status/1375307590314254339,https://web.archive.org/web/20210329013017/https://twitter.com/an_cabraal/status/1375307590314254339,Had a productive meeting with a cross-section of #Company Secretaries to discuss issues faced by them. Registrar of Companies and his team were very cooperative and we  found solutions to almost all their issues. #SriLanka #GoSL #economicrecoveryplan Why is the registrar of company sending some applications for registration to defence ministry for clearance? Under which section of the Act is he empowered to do that? Any Boi project or investment should be a minimum of 2m dollars to stop us been swamped by gram stores muscat shops and saree shops
282,"com,twitter)/an_cabraal/status/1375307590314254339",20210330201749,https://twitter.com/an_cabraal/status/1375307590314254339,https://web.archive.org/web/20210330201749/https://twitter.com/an_cabraal/status/1375307590314254339,Had a productive meeting with a cross-section of #Company Secretaries to discuss issues faced by them. Registrar of Companies and his team were very cooperative and we  found solutions to almost all their issues. #SriLanka #GoSL #economicrecoveryplan Why is the registrar of company sending some applications for registration to defence ministry for clearance? Under which section of the Act is he empowered to do that? Any Boi project or investment should be a minimum of 2m dollars to stop us been swamped by gram stores muscat shops and saree shops
289,"com,twitter)/an_cabraal/status/1378926033039097856",20210405042251,https://twitter.com/an_cabraal/status/1378926033039097856,https://web.archive.org/web/20210405042251/https://twitter.com/an_cabraal/status/1378926033039097856,Multi-lateral institutions seem to be finally heeding the call of emerging nations to deal with the economic fall-out of the #COVID19Pandemic via a #global response - New allocation of #SDRs for USD 650 billion proposed by @IMFNews #SriLanka #GoSL #economicrecoveryplan
307,"com,twitter)/an_cabraal/status/1384065859447001091",20210520050245,https://twitter.com/an_cabraal/status/1384065859447001091,https://web.archive.org/web/20210520050245/https://twitter.com/an_cabraal/status/1384065859447001091,"SL Rupee further appreciated against US Dollar today. Current buying and selling rates of US Dollar are Rs.187.93 &  191.97 respectively - CBSL
We are a Government that does what it says. @HarshadeSilvaMP @FitchRatings @MoodysInvSvc #Rupee #SriLanka #GoSL #economicrecoveryplan Great sir Hats off to your efforts... Stability ia what we need. Fingers crossed. Great Job and excellent strategy what's the strategy? So how was it done exactly sir? By getting a $500m loan from China...any other initiative? Would be good to know  how long will it act as a support to stabilize the rupee and what can we expect in the next 6 months. Need buildup local producers in each sector & recovery of the Tourism sector, able to limit external vulnerability. Sound reserve management practices important for increasing a country's overall resilience to shocks. hope that we can collectively appreciate the Rupee value by another Rs.10 against USD $...... Thumbs up....! 
If we can stabilize rupee value LKR against $  gradually will be reducing all the bad patches It's unbelievable with so much money printing"
308,"com,twitter)/an_cabraal/status/1384065859447001091",20210902031538,https://twitter.com/an_cabraal/status/1384065859447001091,https://web.archive.org/web/20210902031538/https://twitter.com/an_cabraal/status/1384065859447001091,"SL Rupee further appreciated against US Dollar today. Current buying and selling rates of US Dollar are Rs.187.93 &  191.97 respectively - CBSL
We are a Government that does what it says. @HarshadeSilvaMP @FitchRatings @MoodysInvSvc #Rupee #SriLanka #GoSL #economicrecoveryplan Great sir Hats off to your efforts... Stability ia what we need. Fingers crossed. Great Job and excellent strategy what's the strategy? So how was it done exactly sir? By getting a $500m loan from China...any other initiative? Would be good to know  how long will it act as a support to stabilize the rupee and what can we expect in the next 6 months. Need buildup local producers in each sector & recovery of the Tourism sector, able to limit external vulnerability. Sound reserve management practices important for increasing a country's overall resilience to shocks. hope that we can collectively appreciate the Rupee value by another Rs.10 against USD $...... Thumbs up....! 
If we can stabilize rupee value LKR against $  gradually will be reducing all the bad patches Then what went wrong with the Greek Bonds back in recent past??? Also the hedging issue??? Can you elaborate and explain same like you explained about someone working in Port City yesterday????

Other thing why didn't we take a loan from IMF or any other country???"
309,"com,twitter)/an_cabraal/status/1384065859447001091",20210903031058,https://twitter.com/an_cabraal/status/1384065859447001091,https://web.archive.org/web/20210903031058/https://twitter.com/an_cabraal/status/1384065859447001091,"SL Rupee further appreciated against US Dollar today. Current buying and selling rates of US Dollar are Rs.187.93 &  191.97 respectively - CBSL
We are a Government that does what it says. @HarshadeSilvaMP @FitchRatings @MoodysInvSvc #Rupee #SriLanka #GoSL #economicrecoveryplan Great Job and excellent strategy what's the strategy? So how was it done exactly sir? By getting a $500m loan from China...any other initiative? Would be good to know  how long will it act as a support to stabilize the rupee and what can we expect in the next 6 months. Thumbs up....! 
If we can stabilize rupee value LKR against $  gradually will be reducing all the bad patches How stupid can some people think that a 500million loan is the way to appreciate the value of a currency. This is only a way to get colonised to another country.  End of the day USD has moved up to 194 and 200 respectively  tomorrow even further  Sir , you are tweeting when it’s appreciated thanks for that at the same time when it depreciate pls tweet us so that we can sale our dollars A government doing what it says, 'did you mean borrowing money??? Ajiya , we are so proud of you man. Hopefully you get more loans when it hits Rs.200 again. You killing it ."
310,"com,twitter)/an_cabraal/status/1384065859447001091",20210903192834,https://twitter.com/an_cabraal/status/1384065859447001091,https://web.archive.org/web/20210903192834/https://twitter.com/an_cabraal/status/1384065859447001091,"SL Rupee further appreciated against US Dollar today. Current buying and selling rates of US Dollar are Rs.187.93 &  191.97 respectively - CBSL
We are a Government that does what it says. @HarshadeSilvaMP @FitchRatings @MoodysInvSvc #Rupee #SriLanka #GoSL #economicrecoveryplan Great Job and excellent strategy what's the strategy? So how was it done exactly sir? By getting a $500m loan from China...any other initiative? Would be good to know  how long will it act as a support to stabilize the rupee and what can we expect in the next 6 months. Need buildup local producers in each sector & recovery of the Tourism sector, able to limit external vulnerability. Sound reserve management practices important for increasing a country's overall resilience to shocks. hope that we can collectively appreciate the Rupee value by another Rs.10 against USD $...... Thumbs up....! 
If we can stabilize rupee value LKR against $  gradually will be reducing all the bad patches Once tourism and expat remittances pick up it should strengthen further. How stupid can some people think that a 500million loan is the way to appreciate the value of a currency. This is only a way to get colonised to another country.  End of the day USD has moved up to 194 and 200 respectively  tomorrow even further"
311,"com,twitter)/an_cabraal/status/1384065859447001091",20210904031045,https://twitter.com/an_cabraal/status/1384065859447001091,https://web.archive.org/web/20210904031045/https://twitter.com/an_cabraal/status/1384065859447001091,"SL Rupee further appreciated against US Dollar today. Current buying and selling rates of US Dollar are Rs.187.93 &  191.97 respectively - CBSL
We are a Government that does what it says. @HarshadeSilvaMP @FitchRatings @MoodysInvSvc #Rupee #SriLanka #GoSL #economicrecoveryplan Great sir Hats off to your efforts... Stability ia what we need. Fingers crossed. Great Job and excellent strategy what's the strategy? So how was it done exactly sir? By getting a $500m loan from China...any other initiative? Would be good to know  how long will it act as a support to stabilize the rupee and what can we expect in the next 6 months. Need buildup local producers in each sector & recovery of the Tourism sector, able to limit external vulnerability. Sound reserve management practices important for increasing a country's overall resilience to shocks. hope that we can collectively appreciate the Rupee value by another Rs.10 against USD $...... Thumbs up....! 
If we can stabilize rupee value LKR against $  gradually will be reducing all the bad patches Then what went wrong with the Greek Bonds back in recent past??? Also the hedging issue??? Can you elaborate and explain same like you explained about someone working in Port City yesterday????

Other thing why didn't we take a loan from IMF or any other country???"
312,"com,twitter)/an_cabraal/status/1384065859447001091",20210904183646,https://twitter.com/an_cabraal/status/1384065859447001091,https://web.archive.org/web/20210904183646/https://twitter.com/an_cabraal/status/1384065859447001091,"SL Rupee further appreciated against US Dollar today. Current buying and selling rates of US Dollar are Rs.187.93 &  191.97 respectively - CBSL
We are a Government that does what it says. @HarshadeSilvaMP @FitchRatings @MoodysInvSvc #Rupee #SriLanka #GoSL #economicrecoveryplan Great sir Hats off to your efforts... Stability ia what we need. Fingers crossed. Great Job and excellent strategy what's the strategy? So how was it done exactly sir? By getting a $500m loan from China...any other initiative? Would be good to know  how long will it act as a support to stabilize the rupee and what can we expect in the next 6 months. Need buildup local producers in each sector & recovery of the Tourism sector, able to limit external vulnerability. Sound reserve management practices important for increasing a country's overall resilience to shocks. hope that we can collectively appreciate the Rupee value by another Rs.10 against USD $...... Thumbs up....! 
If we can stabilize rupee value LKR against $  gradually will be reducing all the bad patches Then what went wrong with the Greek Bonds back in recent past??? Also the hedging issue??? Can you elaborate and explain same like you explained about someone working in Port City yesterday????

Other thing why didn't we take a loan from IMF or any other country???"
313,"com,twitter)/an_cabraal/status/1384065859447001091",20220308053800,https://twitter.com/an_cabraal/status/1384065859447001091,https://web.archive.org/web/20220308053800/https://twitter.com/an_cabraal/status/1384065859447001091,"SL Rupee further appreciated against US Dollar today. Current buying and selling rates of US Dollar are Rs.187.93 &  191.97 respectively - CBSL
We are a Government that does what it says. @HarshadeSilvaMP @FitchRatings @MoodysInvSvc #Rupee #SriLanka #GoSL #economicrecoveryplan Great sir Hats off to your efforts... Stability ia what we need. Fingers crossed. Great Job and excellent strategy what's the strategy? So how was it done exactly sir? By getting a $500m loan from China...any other initiative? Would be good to know  how long will it act as a support to stabilize the rupee and what can we expect in the next 6 months. Need buildup local producers in each sector & recovery of the Tourism sector, able to limit external vulnerability. Sound reserve management practices important for increasing a country's overall resilience to shocks. hope that we can collectively appreciate the Rupee value by another Rs.10 against USD $...... Thumbs up....! 
If we can stabilize rupee value LKR against $  gradually will be reducing all the bad patches Then what went wrong with the Greek Bonds back in recent past??? Also the hedging issue??? Can you elaborate and explain same like you explained about someone working in Port City yesterday????

Other thing why didn't we take a loan from IMF or any other country???"
314,"com,twitter)/an_cabraal/status/1384065859447001091",20220308184329,https://twitter.com/an_cabraal/status/1384065859447001091,https://web.archive.org/web/20220308184329/https://twitter.com/an_cabraal/status/1384065859447001091,"SL Rupee further appreciated against US Dollar today. Current buying and selling rates of US Dollar are Rs.187.93 &  191.97 respectively - CBSL
We are a Government that does what it says. @HarshadeSilvaMP @FitchRatings @MoodysInvSvc #Rupee #SriLanka #GoSL #economicrecoveryplan Great Job and excellent strategy what's the strategy? So how was it done exactly sir? By getting a $500m loan from China...any other initiative? Would be good to know  how long will it act as a support to stabilize the rupee and what can we expect in the next 6 months. Thumbs up....! 
If we can stabilize rupee value LKR against $  gradually will be reducing all the bad patches How stupid can some people think that a 500million loan is the way to appreciate the value of a currency. This is only a way to get colonised to another country.  End of the day USD has moved up to 194 and 200 respectively  tomorrow even further  Sir , you are tweeting when it’s appreciated thanks for that at the same time when it depreciate pls tweet us so that we can sale our dollars A government doing what it says, 'did you mean borrowing money??? Ajiya , we are so proud of you man. Hopefully you get more loans when it hits Rs.200 again. You killing it ."
